{
  "$schema": "http://json-schema.org/draft-07/schema#",
  "type": [
    "object",
    "null"
  ],
  "title": "RAM Schema",
  "description": "Schema for RAM components",
  "required": [
    "metadata"
  ],
  "properties": {
    "opendb_id": {
      "type": [
        "string",
        "null"
      ],
      "description": "Unique identifier for the document (UUID v4)"
    },
    "speed": {
      "type": [
        "number",
        "null"
      ],
      "description": "The speed of the RAM in MHz (e.g., 6000, 3200)"
    },
    "ram_type": {
      "type": [
        "string",
        "null"
      ],
      "description": "DDR generation (e.g., DDR4, DDR5)"
    },
    "form_factor": {
      "type": [
        "string",
        "null"
      ],
      "description": "The physical form factor of the RAM module (e.g., 288-pin DIMM, 260-pin SO-DIMM)"
    },
    "modules": {
      "type": [
        "object",
        "null"
      ],
      "required": [
        "quantity",
        "capacity_gb"
      ],
      "properties": {
        "quantity": {
          "type": [
            "number",
            "null"
          ],
          "description": "Number of modules in the kit"
        },
        "capacity_gb": {
          "type": [
            "number",
            "null"
          ],
          "description": "Capacity per module in GB"
        }
      }
    },
    "capacity": {
      "type": [
        "number",
        "null"
      ],
      "description": "Total capacity of the RAM kit in GB"
    },
    "color": {
      "type": [
        "array",
        "null"
      ],
      "items": {
        "type": [
          "string",
          "null"
        ]
      },
      "description": "The color of this product (e.g., ['Black', 'Red']). Each color of the product should be included in the array."
    },
    "cas_latency": {
      "type": [
        "number",
        "null"
      ],
      "description": "The CAS latency of the RAM"
    },
    "timings": {
      "type": [
        "string",
        "null"
      ],
      "description": "The complete timing specification of the RAM (e.g., 30-36-36-76)"
    },
    "voltage": {
      "type": [
        "number",
        "null"
      ],
      "description": "The operating voltage of the RAM"
    },
    "ecc": {
      "type": [
        "string",
        "null"
      ],
      "description": "Whether the RAM supports Error-Correcting Code (e.g., Non-ECC, ECC)"
    },
    "registered": {
      "type": [
        "string",
        "null"
      ],
      "description": "Whether the RAM is registered or unbuffered (e.g., Unbuffered, Registered, Load Reduced)"
    },
    "heat_spreader": {
      "type": [
        "boolean",
        "null"
      ],
      "description": "Whether the RAM modules have a heat spreader"
    },
    "rgb": {
      "type": [
        "boolean",
        "null"
      ],
      "description": "Whether the RAM has RGB lighting"
    },
    "height": {
      "type": [
        "number",
        "null"
      ],
      "description": "The height of the RAM module in mm"
    },
    "metadata": {
      "type": [
        "object",
        "null"
      ],
      "required": [
        "name"
      ],
      "properties": {
        "name": {
          "type": "string",
          "description": "Full product name"
        },
        "manufacturer": {
          "type": [
            "string",
            "null"
          ],
          "description": "Product manufacturer"
        },
        "part_numbers": {
          "type": [
            "array",
            "null"
          ],
          "items": {
            "type": "string"
          },
          "description": "Array of manufacturer's part numbers/SKUs"
        },
        "series": {
          "type": [
            "string",
            "null"
          ],
          "description": "Product series name"
        },
        "variant": {
          "type": [
            "string",
            "null"
          ],
          "description": "Specific variant in the series"
        },
        "releaseYear": {
          "type": [
            "number",
            "null"
          ],
          "description": "Year of release"
        }
      }
    },
    "general_product_information": {
      "type": [
        "object",
        "null"
      ],
      "description": "General product information and retailer SKUs",
      "properties": {
        "amazon_sku": {
          "type": [
            "string",
            "null"
          ],
          "description": "Amazon product SKU"
        },
        "newegg_sku": {
          "type": [
            "string",
            "null"
          ],
          "description": "Newegg product SKU"
        },
        "bestbuy_sku": {
          "type": [
            "number",
            "null"
          ],
          "description": "Best Buy product SKU"
        },
        "walmart_sku": {
          "type": [
            "number",
            "null"
          ],
          "description": "Walmart product SKU"
        },
        "adorama_sku": {
          "type": [
            "string",
            "null"
          ],
          "description": "Adorama product SKU"
        },
        "manufacturer_url": {
          "type": [
            "string",
            "null"
          ],
          "description": "Official manufacturer product URL"
        }
      }
    }
  }
}