{
  "opendb_id": "3cadea9c-ae76-4f64-9853-e0fca77cf528",
  "modules": {
    "quantity": 2,
    "capacity_gb": 8
  },
  "metadata": {
    "name": "Crucial Ballistix RGB DDR4-3200 CL16 16GB (2x8GB)",
    "manufacturer": "Crucial",
    "part_numbers": [
      "BL2K8G32C16U4WL"
    ],
    "series": "Ballistix",
    "variant": "3200 CL16"
  },
  "speed": 3200,
  "ram_type": "DDR4",
  "form_factor": "288-pin DIMM (DDR4)",
  "capacity": 16,
  "color": [
    "WHITE"
  ],
  "cas_latency": 16,
  "voltage": null,
  "ecc": "Non-ECC",
  "registered": "Unbuffered",
  "heat_spreader": true,
  "rgb": true,
  "general_product_information": {}
}