{
  "opendb_id": "53c9a4b7-5efa-45d5-857e-539a95ca944e",
  "modules": {
    "quantity": 1,
    "capacity_gb": 32
  },
  "metadata": {
    "name": "Silicon Power XPOWER Zenith Gaming White DDR5-5200 CL38 32GB (1x32GB)",
    "manufacturer": "Silicon Power",
    "part_numbers": [
      "SP032GXLWU520FSG"
    ],
    "series": "XPOWER",
    "variant": "5200 CL38"
  },
  "speed": 5200,
  "ram_type": "DDR5",
  "form_factor": "288-pin DIMM (DDR5)",
  "capacity": 32,
  "color": [
    "WHITE"
  ],
  "cas_latency": 38,
  "voltage": 1.25,
  "ecc": "Non-ECC",
  "registered": "Unbuffered",
  "heat_spreader": true,
  "rgb": false,
  "timings": "38-38-38-84",
  "height": 38.5,
  "general_product_information": {
    "manufacturer_url": "https://www.silicon-power.com/en/product-detail/XPOWER_Zenith_DDR5_Gaming_UDIMM/"
  }
}