{
  "opendb_id": "befb18b2-d220-4496-b50f-e1242349ff42",
  "modules": {
    "quantity": 4,
    "capacity_gb": 32
  },
  "metadata": {
    "name": "V-Color TRA532G56S436Q White Registered DDR5-5600 CL36 128GB (4x32GB)",
    "manufacturer": "v-color",
    "part_numbers": [
      "TRA532G56S436Q"
    ],
    "series": "TRA532G56S436Q",
    "variant": "5600 CL36"
  },
  "speed": 5600,
  "ram_type": "DDR5",
  "form_factor": "288-pin DIMM (DDR5)",
  "capacity": 128,
  "color": [
    "WHITE"
  ],
  "cas_latency": 36,
  "timings": "36-38-38-80",
  "voltage": null,
  "ecc": "Non-ECC",
  "registered": "Unbuffered",
  "heat_spreader": true,
  "rgb": false,
  "general_product_information": {
    "amazon_sku": "B0CQJLL688",
    "newegg_sku": "2SJ-004R-00023"
  }
}