{
  "opendb_id": "1828c67a-c237-43dc-8aca-3c5c2f6a2a67",
  "modules": {
    "quantity": 4,
    "capacity_gb": 16
  },
  "metadata": {
    "name": "Corsair Dominator Platinum RGB Black DDR5-6200 CL32 64GB (4x16GB)",
    "manufacturer": "Corsair",
    "part_numbers": [
      "CMT64GX5M4B6200C32"
    ],
    "series": "Dominator",
    "variant": "6200 CL32"
  },
  "speed": 6200,
  "ram_type": "DDR5",
  "form_factor": "288-pin DIMM (DDR5)",
  "capacity": 64,
  "color": [
    "BLACK"
  ],
  "cas_latency": 32,
  "timings": "32-38-38-80",
  "voltage": null,
  "ecc": "Non-ECC",
  "registered": "Unbuffered",
  "heat_spreader": true,
  "rgb": true,
  "general_product_information": {
    "amazon_sku": "B0BVKZGDNN",
    "walmart_sku": 3049157055
  }
}