{
  "opendb_id": "d85e3d98-a3ba-45ce-acf8-27a02affbfdb",
  "modules": {
    "quantity": 1,
    "capacity_gb": 16
  },
  "metadata": {
    "name": "Patriot Viper Venom RGB Black / White DDR5-6000 CL30 16GB (1x16GB)",
    "manufacturer": "Patriot",
    "part_numbers": [
      "PVVR516G60C30"
    ],
    "series": "Viper",
    "variant": "6000 CL30"
  },
  "speed": 6000,
  "ram_type": "DDR5",
  "form_factor": "288-pin DIMM (DDR5)",
  "capacity": 16,
  "color": [
    "BLACK",
    "WHITE"
  ],
  "cas_latency": 30,
  "timings": "30-40-40-76",
  "voltage": null,
  "ecc": "Non-ECC",
  "registered": "Unbuffered",
  "heat_spreader": true,
  "rgb": true,
  "general_product_information": {
    "amazon_sku": "B0DJ1W694Y"
  }
}