{
  "opendb_id": "7b6bd3b3-715f-4b6e-8757-3728f92aed35",
  "modules": {
    "quantity": 2,
    "capacity_gb": 8
  },
  "metadata": {
    "name": "Corsair Vengeance RGB Black / Gray DDR5-5200 CL40 16GB (2x8GB)",
    "manufacturer": "Corsair",
    "part_numbers": [
      "CMH16GX5M2B5200C40"
    ],
    "series": "Vengeance",
    "variant": "5200 CL40"
  },
  "speed": 5200,
  "ram_type": "DDR5",
  "form_factor": "288-pin DIMM (DDR5)",
  "capacity": 16,
  "color": [
    "BLACK",
    "GREY"
  ],
  "cas_latency": 40,
  "timings": "40-40-40-77",
  "voltage": null,
  "ecc": "Non-ECC",
  "registered": "Unbuffered",
  "heat_spreader": true,
  "rgb": true,
  "general_product_information": {
    "amazon_sku": "B0D9PRVBRZ",
    "newegg_sku": "N82E16820982196"
  }
}