{
  "opendb_id": "5dc7b878-f145-49c8-96e4-42d2beba40b2",
  "modules": {
    "quantity": 2,
    "capacity_gb": 16
  },
  "metadata": {
    "name": "TEAMGROUP T-Force Vulcan Red DDR5-6000 CL28 32GB (2x16GB)",
    "manufacturer": "TEAMGROUP",
    "part_numbers": [
      "FLRD532G6000HC28ADC01"
    ],
    "series": "T-Force",
    "variant": "6000 CL28"
  },
  "speed": 6000,
  "ram_type": "DDR5",
  "form_factor": "288-pin DIMM (DDR5)",
  "capacity": 32,
  "color": [
    "RED"
  ],
  "cas_latency": 28,
  "timings": "28-36-36-76",
  "voltage": null,
  "ecc": "Non-ECC",
  "registered": "Unbuffered",
  "heat_spreader": true,
  "rgb": false,
  "general_product_information": {}
}