{
  "opendb_id": "a6f7e822-6e33-4957-9c89-c3fd2bebe9a7",
  "modules": {
    "quantity": 1,
    "capacity_gb": 8
  },
  "metadata": {
    "name": "PNY MN8192SD3-1600-X9 Green SODIMM DDR3-1600 CL9 8GB (1x8GB)",
    "manufacturer": "PNY",
    "part_numbers": [
      "MN8192SD3-1600-X9"
    ],
    "series": "MN8192SD3-1600-X9",
    "variant": "1600 CL9"
  },
  "speed": 1600,
  "ram_type": "DDR3",
  "form_factor": "204-pin SODIMM (DDR3)",
  "capacity": 8,
  "color": [
    "GREEN"
  ],
  "cas_latency": 9,
  "voltage": null,
  "ecc": "Non-ECC",
  "registered": "Unbuffered",
  "heat_spreader": false,
  "rgb": false,
  "general_product_information": {}
}