{
  "opendb_id": "ee71f900-2a46-4736-8a26-84e6d83004a0",
  "modules": {
    "quantity": 1,
    "capacity_gb": 32
  },
  "metadata": {
    "name": "Kingston Server Premier DDR4-2933 CL21 32GB (1x32GB)",
    "manufacturer": "Kingston",
    "part_numbers": [
      "KSM29ED8",
      "32ME"
    ],
    "series": "Server",
    "variant": "2933 CL21"
  },
  "speed": 2933,
  "ram_type": "DDR4",
  "form_factor": "288-pin DIMM (DDR4)",
  "capacity": 32,
  "color": [],
  "cas_latency": 21,
  "voltage": null,
  "ecc": "Non-ECC",
  "registered": "Unbuffered",
  "heat_spreader": false,
  "rgb": false,
  "general_product_information": {
    "amazon_sku": "B08GKT9M6G",
    "walmart_sku": 356741064
  }
}