{
  "opendb_id": "f5500fee-17e5-4f6f-b517-feee4d94db36",
  "modules": {
    "quantity": 1,
    "capacity_gb": 8
  },
  "metadata": {
    "name": "AMD R7 Performance Black / Red DDR4-2400 CL15 8GB (1x8GB)",
    "manufacturer": "AMD",
    "part_numbers": [
      "R748G2400U2S"
    ],
    "series": "R7",
    "variant": "2400 CL15"
  },
  "speed": 2400,
  "ram_type": "DDR4",
  "form_factor": "288-pin DIMM (DDR4)",
  "capacity": 8,
  "color": [
    "BLACK",
    "RED"
  ],
  "cas_latency": 15,
  "voltage": null,
  "ecc": "Non-ECC",
  "registered": "Unbuffered",
  "heat_spreader": true,
  "rgb": false,
  "general_product_information": {}
}