{
  "opendb_id": "2cc7e682-aa16-4b2d-972c-f67d9f2a2205",
  "modules": {
    "quantity": 2,
    "capacity_gb": 32
  },
  "metadata": {
    "name": "G.Skill Ripjaws S5 Black DDR5-5600 CL46 64GB (2x32GB)",
    "manufacturer": "G.SKILL",
    "part_numbers": [
      "F5-5600J4645A32GX2-RS5K"
    ],
    "series": "Ripjaws",
    "variant": "5600 CL46"
  },
  "speed": 5600,
  "ram_type": "DDR5",
  "form_factor": "288-pin DIMM (DDR5)",
  "capacity": 64,
  "color": [
    "BLACK"
  ],
  "cas_latency": 46,
  "timings": "46-45-45-89",
  "voltage": null,
  "ecc": "Non-ECC",
  "registered": "Unbuffered",
  "heat_spreader": true,
  "rgb": false,
  "general_product_information": {
    "newegg_sku": "N82E16820374576"
  }
}