{
  "opendb_id": "b9dd6277-9dae-4a4e-aee7-0c4227c448a2",
  "modules": {
    "quantity": 2,
    "capacity_gb": 16
  },
  "metadata": {
    "name": "Corsair Vengeance RGB Black DDR5-6800 CL40 32GB (2x16GB)",
    "manufacturer": "Corsair",
    "part_numbers": [
      "CMH32GX5M2B6800C40"
    ],
    "series": "Vengeance",
    "variant": "6800 CL40"
  },
  "speed": 6800,
  "ram_type": "DDR5",
  "form_factor": "288-pin DIMM (DDR5)",
  "capacity": 32,
  "color": [
    "BLACK"
  ],
  "cas_latency": 40,
  "timings": "40-50-50-110",
  "voltage": null,
  "ecc": "Non-ECC",
  "registered": "Unbuffered",
  "heat_spreader": true,
  "rgb": true,
  "general_product_information": {
    "amazon_sku": "B0BXHC1HY8",
    "newegg_sku": "N82E16820236981"
  }
}