{
  "opendb_id": "90ab3aca-b875-44f3-8378-569d6c042838",
  "modules": {
    "quantity": 2,
    "capacity_gb": 8
  },
  "metadata": {
    "name": "PNY Anarchy Black/Blue DDR4-2133 CL15 16GB (2x8GB)",
    "manufacturer": "PNY",
    "part_numbers": [
      "MD16GK2D4213315AB"
    ],
    "series": "Anarchy",
    "variant": "2133 CL15"
  },
  "speed": 2133,
  "ram_type": "DDR4",
  "form_factor": "288-pin DIMM (DDR4)",
  "capacity": 16,
  "color": [
    "BLACK",
    "BLUE"
  ],
  "cas_latency": 15,
  "voltage": null,
  "ecc": "Non-ECC",
  "registered": "Unbuffered",
  "heat_spreader": true,
  "rgb": false,
  "general_product_information": {}
}