{
  "opendb_id": "bbfbe485-c093-475f-943d-be4deaa9ad36",
  "modules": {
    "quantity": 2,
    "capacity_gb": 32
  },
  "metadata": {
    "name": "GOODRAM IRDM Black DDR5-6400 CL32 64GB (2x32GB)",
    "manufacturer": "GOODRAM",
    "part_numbers": [
      "IR-6400D564L32",
      "64GDC"
    ],
    "series": "IRDM",
    "variant": "6400 CL32"
  },
  "speed": 6400,
  "ram_type": "DDR5",
  "form_factor": "288-pin DIMM (DDR5)",
  "capacity": 64,
  "color": [
    "BLACK"
  ],
  "cas_latency": 32,
  "timings": "32-38-38-102",
  "voltage": null,
  "ecc": "Non-ECC",
  "registered": "Unbuffered",
  "heat_spreader": true,
  "rgb": false,
  "general_product_information": {}
}