{
  "opendb_id": "d3864a25-c98b-4716-a243-acde1b1ec5c4",
  "modules": {
    "quantity": 1,
    "capacity_gb": 32
  },
  "metadata": {
    "name": "Kingston Server Premier DDR4-3200 CL22 32GB (1x32GB)",
    "manufacturer": "Kingston",
    "part_numbers": [
      "KSM32ED8",
      "32HC"
    ],
    "series": "Server",
    "variant": "3200 CL22"
  },
  "speed": 3200,
  "ram_type": "DDR4",
  "form_factor": "288-pin DIMM (DDR4)",
  "capacity": 32,
  "color": [],
  "cas_latency": 22,
  "voltage": null,
  "ecc": "Non-ECC",
  "registered": "Unbuffered",
  "heat_spreader": false,
  "rgb": false,
  "general_product_information": {
    "amazon_sku": "B09N9V1ZS4",
    "newegg_sku": "0RN-001J-013R4",
    "walmart_sku": 288587934
  }
}