{
  "opendb_id": "233a88f0-244c-4d03-acc7-9215279189ea",
  "modules": {
    "quantity": 4,
    "capacity_gb": 4
  },
  "metadata": {
    "name": "Corsair Vengeance Black / Yellow DDR3-1600 CL9 16GB (4x4GB)",
    "manufacturer": "Corsair",
    "part_numbers": [
      "CML16GX3M4A1600C9"
    ],
    "series": "Vengeance",
    "variant": "1600 CL9"
  },
  "speed": 1600,
  "ram_type": "DDR3",
  "form_factor": "240-pin DIMM (DDR3)",
  "capacity": 16,
  "color": [
    "BLACK",
    "YELLOW"
  ],
  "cas_latency": 9,
  "timings": "9-9-9-24",
  "voltage": null,
  "ecc": "Non-ECC",
  "registered": "Unbuffered",
  "heat_spreader": true,
  "rgb": false,
  "general_product_information": {}
}