{
  "opendb_id": "8a124d1b-041d-4e4e-bd64-432931252d40",
  "modules": {
    "quantity": 2,
    "capacity_gb": 24
  },
  "metadata": {
    "name": "Crucial Pro Black DDR5-5600 CL46 48GB (2x24GB)",
    "manufacturer": "Crucial",
    "part_numbers": [
      "CP2K24G56C46U5"
    ],
    "series": "Pro",
    "variant": "5600 CL46"
  },
  "speed": 5600,
  "ram_type": "DDR5",
  "form_factor": "288-pin DIMM (DDR5)",
  "capacity": 48,
  "color": [
    "BLACK"
  ],
  "cas_latency": 46,
  "voltage": null,
  "ecc": "Non-ECC",
  "registered": "Unbuffered",
  "heat_spreader": true,
  "rgb": false,
  "general_product_information": {
    "amazon_sku": "B0C79T75PY",
    "newegg_sku": "N82E16820156381",
    "walmart_sku": 1943633943
  }
}