{
  "opendb_id": "6eacf41c-b711-49bd-8359-769dc3711833",
  "modules": {
    "quantity": 2,
    "capacity_gb": 16
  },
  "metadata": {
    "name": "ADATA XPG SPECTRIX D50 Black DDR4-3200 CL16 32GB (2x16GB)",
    "manufacturer": "ADATA",
    "part_numbers": [
      "AX4U320016G16A-DT50"
    ],
    "series": "XPG",
    "variant": "3200 CL16"
  },
  "speed": 3200,
  "ram_type": "DDR4",
  "form_factor": "288-pin DIMM (DDR4)",
  "capacity": 32,
  "color": [
    "BLACK"
  ],
  "cas_latency": 16,
  "voltage": null,
  "ecc": "Non-ECC",
  "registered": "Unbuffered",
  "heat_spreader": true,
  "rgb": false,
  "general_product_information": {
    "amazon_sku": "B092FZYB5W"
  }
}